gutenberg_id,text
84,"fellow creatures. At one time the moon, which had before been clear, was"
84,"suddenly overspread by a thick cloud, and I took advantage of the moment of"
84,darkness and cast my basket into the sea; I listened to the gurgling sound
84,"as it sank and then sailed away from the spot. The sky became clouded, but"
84,"the air was pure, although chilled by the northeast breeze that was then"
84,rising. But it refreshed me and filled me with such agreeable sensations
84,"that I resolved to prolong my stay on the water, and fixing the rudder in a"
84,"direct position, stretched myself at the bottom of the boat. Clouds hid the"
84,"moon, everything was obscure, and I heard only the sound of the boat as its"
84,"keel cut through the waves; the murmur lulled me, and in a short time I"
84,slept soundly.
84,
84,"I do not know how long I remained in this situation, but when I awoke I"
84,"found that the sun had already mounted considerably. The wind was high, and"
84,the waves continually threatened the safety of my little skiff. I found
84,that the wind was northeast and must have driven me far from the coast from
84,which I had embarked. I endeavoured to change my course but quickly found
84,that if I again made the attempt the boat would be instantly filled with
84,"water. Thus situated, my only resource was to drive before the wind. I"
84,confess that I felt a few sensations of terror. I had no compass with me
84,and was so slenderly acquainted with the geography of this part of the
84,world that the sun was of little benefit to me. I might be driven into the
84,wide Atlantic and feel all the tortures of starvation or be swallowed up in
84,the immeasurable waters that roared and buffeted around me. I had already
84,"been out many hours and felt the torment of a burning thirst, a prelude to"
84,"my other sufferings. I looked on the heavens, which were covered by clouds"
84,"that flew before the wind, only to be replaced by others; I looked upon the"
84,"sea; it was to be my grave. “Fiend,” I exclaimed, “your"
84,"task is already fulfilled!” I thought of Elizabeth, of my father, and"
84,"of Clerval—all left behind, on whom the monster might satisfy his"
84,sanguinary and merciless passions. This idea plunged me into a reverie so
84,"despairing and frightful that even now, when the scene is on the point of"
84,"closing before me for ever, I shudder to reflect on it."
84,
84,"Some hours passed thus; but by degrees, as the sun declined towards the"
84,"horizon, the wind died away into a gentle breeze and the sea became"
84,free from breakers. But these gave place to a heavy swell; I felt sick
84,"and hardly able to hold the rudder, when suddenly I saw a line of high"
84,land towards the south.
84,
84,"Almost spent, as I was, by fatigue and the dreadful suspense I endured"
84,"for several hours, this sudden certainty of life rushed like a flood of"
84,"warm joy to my heart, and tears gushed from my eyes."
84,
84,"How mutable are our feelings, and how strange is that clinging love we have"
84,of life even in the excess of misery! I constructed another sail with a
84,part of my dress and eagerly steered my course towards the land. It had a
84,"wild and rocky appearance, but as I approached nearer I easily perceived"
84,the traces of cultivation. I saw vessels near the shore and found myself
84,suddenly transported back to the neighbourhood of civilised man. I
84,carefully traced the windings of the land and hailed a steeple which I at
84,length saw issuing from behind a small promontory. As I was in a state of
84,"extreme debility, I resolved to sail directly towards the town, as a place"
84,where I could most easily procure nourishment. Fortunately I had money with
84,me. As I turned the promontory I perceived a small neat town and a good
84,"harbour, which I entered, my heart bounding with joy at my unexpected"
84,escape.
84,
84,"As I was occupied in fixing the boat and arranging the sails, several"
84,people crowded towards the spot. They seemed much surprised at my
84,"appearance, but instead of offering me any assistance, whispered"
84,together with gestures that at any other time might have produced in me
84,"a slight sensation of alarm. As it was, I merely remarked that they"
84,"spoke English, and I therefore addressed them in that language. “My"
84,"good friends,” said I, “will you be so kind as to tell me the name of"
84,this town and inform me where I am?”
84,
84,"“You will know that soon enough,” replied a man with a hoarse voice."
84,"“Maybe you are come to a place that will not prove much to your taste,"
84,"but you will not be consulted as to your quarters, I promise you.”"
84,
84,I was exceedingly surprised on receiving so rude an answer from a
84,"stranger, and I was also disconcerted on perceiving the frowning and"
84,angry countenances of his companions. “Why do you answer me so
84,roughly?” I replied. “Surely it is not the custom of Englishmen to
84,receive strangers so inhospitably.”
84,
84,"“I do not know,” said the man, “what the custom of the"
84,"English may be, but it is the custom of the Irish to hate villains.”"
84,
84,"While this strange dialogue continued, I perceived the crowd rapidly"
84,"increase. Their faces expressed a mixture of curiosity and anger, which"
84,"annoyed and in some degree alarmed me. I inquired the way to the inn, but"
84,"no one replied. I then moved forward, and a murmuring sound arose from the"
84,"crowd as they followed and surrounded me, when an ill-looking man"
84,"approaching tapped me on the shoulder and said, “Come, sir, you must"
84,follow me to Mr. Kirwin’s to give an account of yourself.”
84,
84,“Who is Mr. Kirwin? Why am I to give an account of myself? Is not
84,this a free country?”
84,
84,"“Ay, sir, free enough for honest folks. Mr. Kirwin is a magistrate,"
84,and you are to give an account of the death of a gentleman who was
84,found murdered here last night.”
84,
84,"This answer startled me, but I presently recovered myself. I was innocent;"
84,that could easily be proved; accordingly I followed my conductor in silence
84,and was led to one of the best houses in the town. I was ready to sink from
84,"fatigue and hunger, but being surrounded by a crowd, I thought it politic"
84,"to rouse all my strength, that no physical debility might be construed into"
84,apprehension or conscious guilt. Little did I then expect the calamity that
84,was in a few moments to overwhelm me and extinguish in horror and despair
84,all fear of ignominy or death.
84,
84,"I must pause here, for it requires all my fortitude to recall the memory of"
84,"the frightful events which I am about to relate, in proper detail, to my"
84,recollection.
84,
84,
84,
84,
84,Chapter 21
84,
84,
84,"I was soon introduced into the presence of the magistrate, an old"
84,"benevolent man with calm and mild manners. He looked upon me, however,"
84,"with some degree of severity, and then, turning towards my conductors,"
84,he asked who appeared as witnesses on this occasion.
84,
84,"About half a dozen men came forward; and, one being selected by the"
84,"magistrate, he deposed that he had been out fishing the night before with"
84,"his son and brother-in-law, Daniel Nugent, when, about ten o’clock,"
84,"they observed a strong northerly blast rising, and they accordingly put in"
84,"for port. It was a very dark night, as the moon had not yet risen; they did"
84,"not land at the harbour, but, as they had been accustomed, at a creek about"
84,"two miles below. He walked on first, carrying a part of the fishing tackle,"
84,and his companions followed him at some distance. As he was proceeding
84,"along the sands, he struck his foot against something and fell at his"
84,"length on the ground. His companions came up to assist him, and by the"
84,"light of their lantern they found that he had fallen on the body of a man,"
84,who was to all appearance dead. Their first supposition was that it was the
84,corpse of some person who had been drowned and was thrown on shore by the
84,"waves, but on examination they found that the clothes were not wet and even"
84,that the body was not then cold. They instantly carried it to the cottage
84,"of an old woman near the spot and endeavoured, but in vain, to restore it"
84,"to life. It appeared to be a handsome young man, about five and twenty"
84,"years of age. He had apparently been strangled, for there was no sign of"
84,any violence except the black mark of fingers on his neck.
84,
84,"The first part of this deposition did not in the least interest me, but"
84,when the mark of the fingers was mentioned I remembered the murder of
84,"my brother and felt myself extremely agitated; my limbs trembled, and a"
84,"mist came over my eyes, which obliged me to lean on a chair for"
84,support. The magistrate observed me with a keen eye and of course drew
84,an unfavourable augury from my manner.
84,
84,"The son confirmed his father’s account, but when Daniel Nugent was"
84,"called he swore positively that just before the fall of his companion, he"
84,"saw a boat, with a single man in it, at a short distance from the shore;"
84,"and as far as he could judge by the light of a few stars, it was the same"
84,boat in which I had just landed.
84,
84,A woman deposed that she lived near the beach and was standing at the door
84,"of her cottage, waiting for the return of the fishermen, about an hour"
84,"before she heard of the discovery of the body, when she saw a boat with"
84,only one man in it push off from that part of the shore where the corpse
84,was afterwards found.
84,
84,Another woman confirmed the account of the fishermen having brought the
84,body into her house; it was not cold. They put it into a bed and
84,"rubbed it, and Daniel went to the town for an apothecary, but life was"
84,quite gone.
84,
84,"Several other men were examined concerning my landing, and they agreed"
84,"that, with the strong north wind that had arisen during the night, it"
84,was very probable that I had beaten about for many hours and had been
84,obliged to return nearly to the same spot from which I had departed.
84,"Besides, they observed that it appeared that I had brought the body"
84,"from another place, and it was likely that as I did not appear to know"
84,"the shore, I might have put into the harbour ignorant of the distance"
84,of the town of —— from the place where I had deposited the corpse.
84,
84,"Mr. Kirwin, on hearing this evidence, desired that I should be taken into"
84,"the room where the body lay for interment, that it might be observed what"
84,effect the sight of it would produce upon me. This idea was probably
84,suggested by the extreme agitation I had exhibited when the mode of the
84,"murder had been described. I was accordingly conducted, by the magistrate"
84,"and several other persons, to the inn. I could not help being struck by the"
84,"strange coincidences that had taken place during this eventful night; but,"
84,knowing that I had been conversing with several persons in the island I had
84,"inhabited about the time that the body had been found, I was perfectly"
84,tranquil as to the consequences of the affair.
84,
84,I entered the room where the corpse lay and was led up to the coffin. How
84,can I describe my sensations on beholding it? I feel yet parched with
84,"horror, nor can I reflect on that terrible moment without shuddering and"
84,"agony. The examination, the presence of the magistrate and witnesses,"
84,passed like a dream from my memory when I saw the lifeless form of Henry
84,"Clerval stretched before me. I gasped for breath, and throwing myself on"
84,"the body, I exclaimed, “Have my murderous machinations deprived you"
84,"also, my dearest Henry, of life? Two I have already destroyed; other"
84,"victims await their destiny; but you, Clerval, my friend, my"
84,benefactor—”
84,
84,"The human frame could no longer support the agonies that I endured, and"
84,I was carried out of the room in strong convulsions.
84,
84,A fever succeeded to this. I lay for two months on the point of death; my
84,"ravings, as I afterwards heard, were frightful; I called myself the"
84,"murderer of William, of Justine, and of Clerval. Sometimes I entreated my"
84,attendants to assist me in the destruction of the fiend by whom I was
84,tormented; and at others I felt the fingers of the monster already grasping
84,"my neck, and screamed aloud with agony and terror. Fortunately, as I spoke"
84,"my native language, Mr. Kirwin alone understood me; but my gestures and"
84,bitter cries were sufficient to affright the other witnesses.
84,
84,"Why did I not die? More miserable than man ever was before, why did I not"
84,sink into forgetfulness and rest? Death snatches away many blooming
84,"children, the only hopes of their doting parents; how many brides and"
84,"youthful lovers have been one day in the bloom of health and hope, and the"
84,next a prey for worms and the decay of the tomb! Of what materials was I
84,"made that I could thus resist so many shocks, which, like the turning of"
84,"the wheel, continually renewed the torture?"
84,
84,But I was doomed to live and in two months found myself as awaking from
84,"a dream, in a prison, stretched on a wretched bed, surrounded by"
84,"gaolers, turnkeys, bolts, and all the miserable apparatus of a dungeon."
84,"It was morning, I remember, when I thus awoke to understanding; I had"
84,forgotten the particulars of what had happened and only felt as if some
84,great misfortune had suddenly overwhelmed me; but when I looked around
84,and saw the barred windows and the squalidness of the room in which I
84,"was, all flashed across my memory and I groaned bitterly."
84,
84,This sound disturbed an old woman who was sleeping in a chair beside
84,"me. She was a hired nurse, the wife of one of the turnkeys, and her"
84,countenance expressed all those bad qualities which often characterise
84,"that class. The lines of her face were hard and rude, like that of"
84,persons accustomed to see without sympathising in sights of misery. Her
84,"tone expressed her entire indifference; she addressed me in English,"
84,and the voice struck me as one that I had heard during my sufferings.
84,
84,"“Are you better now, sir?” said she."
84,
84,"I replied in the same language, with a feeble voice, “I believe I am;"
84,"but if it be all true, if indeed I did not dream, I am sorry that I am"
84,still alive to feel this misery and horror.”
84,
84,"“For that matter,” replied the old woman, “if you mean about the"
84,"gentleman you murdered, I believe that it were better for you if you"
84,"were dead, for I fancy it will go hard with you! However, that’s none"
84,of my business; I am sent to nurse you and get you well; I do my duty
84,with a safe conscience; it were well if everybody did the same.”
84,
84,I turned with loathing from the woman who could utter so unfeeling a
84,"speech to a person just saved, on the very edge of death; but I felt"
84,languid and unable to reflect on all that had passed. The whole series
84,of my life appeared to me as a dream; I sometimes doubted if indeed it
84,"were all true, for it never presented itself to my mind with the force"
84,of reality.
84,
84,"As the images that floated before me became more distinct, I grew"
84,feverish; a darkness pressed around me; no one was near me who soothed
84,me with the gentle voice of love; no dear hand supported me. The
84,"physician came and prescribed medicines, and the old woman prepared"
84,"them for me; but utter carelessness was visible in the first, and the"
84,expression of brutality was strongly marked in the visage of the
84,second. Who could be interested in the fate of a murderer but the
84,hangman who would gain his fee?
84,
84,"These were my first reflections, but I soon learned that Mr. Kirwin had"
84,shown me extreme kindness. He had caused the best room in the prison
84,to be prepared for me (wretched indeed was the best); and it was he who
84,"had provided a physician and a nurse. It is true, he seldom came to"
84,"see me, for although he ardently desired to relieve the sufferings of"
84,"every human creature, he did not wish to be present at the agonies and"
84,"miserable ravings of a murderer. He came, therefore, sometimes to see"
84,"that I was not neglected, but his visits were short and with long"
84,intervals.
84,
84,"One day, while I was gradually recovering, I was seated in a chair, my eyes"
84,half open and my cheeks livid like those in death. I was overcome by gloom
84,and misery and often reflected I had better seek death than desire to
84,remain in a world which to me was replete with wretchedness. At one time I
84,considered whether I should not declare myself guilty and suffer the
84,"penalty of the law, less innocent than poor Justine had been. Such were my"
84,thoughts when the door of my apartment was opened and Mr. Kirwin entered.
84,His countenance expressed sympathy and compassion; he drew a chair close to
84,"mine and addressed me in French,"
84,
84,“I fear that this place is very shocking to you; can I do anything to
84,make you more comfortable?”
84,
84,"“I thank you, but all that you mention is nothing to me; on the whole"
84,earth there is no comfort which I am capable of receiving.”
84,
84,“I know that the sympathy of a stranger can be but of little relief to
84,"one borne down as you are by so strange a misfortune. But you will, I"
84,"hope, soon quit this melancholy abode, for doubtless evidence can"
84,easily be brought to free you from the criminal charge.”
84,
84,"“That is my least concern; I am, by a course of strange events, become"
84,the most miserable of mortals. Persecuted and tortured as I am and
84,"have been, can death be any evil to me?”"
84,
84,“Nothing indeed could be more unfortunate and agonising than the
84,"strange chances that have lately occurred. You were thrown, by some"
84,"surprising accident, on this shore, renowned for its hospitality,"
84,"seized immediately, and charged with murder. The first sight that was"
84,"presented to your eyes was the body of your friend, murdered in so"
84,"unaccountable a manner and placed, as it were, by some fiend across"
84,your path.”
84,
84,"As Mr. Kirwin said this, notwithstanding the agitation I endured on"
84,"this retrospect of my sufferings, I also felt considerable surprise at"
84,the knowledge he seemed to possess concerning me. I suppose some
84,"astonishment was exhibited in my countenance, for Mr. Kirwin hastened"
84,"to say,"
84,
84,"“Immediately upon your being taken ill, all the papers that were on"
84,"your person were brought me, and I examined them that I might discover some"
84,trace by which I could send to your relations an account of your misfortune
84,"and illness. I found several letters, and, among others, one which I"
84,discovered from its commencement to be from your father. I instantly wrote
84,to Geneva; nearly two months have elapsed since the departure of my letter.
84,But you are ill; even now you tremble; you are unfit for agitation of any
84,kind.”
84,
84,“This suspense is a thousand times worse than the most horrible event;
84,"tell me what new scene of death has been acted, and whose murder I am"
84,now to lament?”
84,
84,"“Your family is perfectly well,” said Mr. Kirwin with"
84,"gentleness; “and someone, a friend, is come to visit you.”"
84,
84,"I know not by what chain of thought the idea presented itself, but it"
84,instantly darted into my mind that the murderer had come to mock at my
84,"misery and taunt me with the death of Clerval, as a new incitement for"
84,"me to comply with his hellish desires. I put my hand before my eyes,"
84,"and cried out in agony,"
84,
84,"“Oh! Take him away! I cannot see him; for God’s sake, do not"
84,let him enter!”
84,
84,Mr. Kirwin regarded me with a troubled countenance. He could not help
84,regarding my exclamation as a presumption of my guilt and said in
84,"rather a severe tone,"
84,
84,"“I should have thought, young man, that the presence of your father"
84,would have been welcome instead of inspiring such violent repugnance.”
84,
84,"“My father!” cried I, while every feature and every muscle was relaxed"
84,"from anguish to pleasure. “Is my father indeed come? How kind, how"
84,"very kind! But where is he, why does he not hasten to me?”"
84,
84,My change of manner surprised and pleased the magistrate; perhaps he
84,"thought that my former exclamation was a momentary return of delirium,"
84,and now he instantly resumed his former benevolence. He rose and
84,"quitted the room with my nurse, and in a moment my father entered it."
84,
84,"Nothing, at this moment, could have given me greater pleasure than the"
84,"arrival of my father. I stretched out my hand to him and cried,"
84,
84,“Are you then safe—and Elizabeth—and Ernest?”
84,
84,"My father calmed me with assurances of their welfare and endeavoured, by"
84,"dwelling on these subjects so interesting to my heart, to raise my"
84,desponding spirits; but he soon felt that a prison cannot be the abode of
84,"cheerfulness. “What a place is this that you inhabit, my son!”"
84,"said he, looking mournfully at the barred windows and wretched appearance"
84,"of the room. “You travelled to seek happiness, but a fatality seems"
84,to pursue you. And poor Clerval—”
84,
84,The name of my unfortunate and murdered friend was an agitation too
84,great to be endured in my weak state; I shed tears.
84,
84,"“Alas! Yes, my father,” replied I; “some destiny of the"
84,"most horrible kind hangs over me, and I must live to fulfil it, or surely I"
84,should have died on the coffin of Henry.”
84,
84,"We were not allowed to converse for any length of time, for the"
84,precarious state of my health rendered every precaution necessary that
84,could ensure tranquillity. Mr. Kirwin came in and insisted that my
84,strength should not be exhausted by too much exertion. But the
84,"appearance of my father was to me like that of my good angel, and I"
84,gradually recovered my health.
84,
84,"As my sickness quitted me, I was absorbed by a gloomy and black"
84,melancholy that nothing could dissipate. The image of Clerval was
84,"for ever before me, ghastly and murdered. More than once the agitation"
84,into which these reflections threw me made my friends dread a dangerous
84,relapse. Alas! Why did they preserve so miserable and detested a
84,"life? It was surely that I might fulfil my destiny, which is now"
84,"drawing to a close. Soon, oh, very soon, will death extinguish these"
84,throbbings and relieve me from the mighty weight of anguish that bears
84,"me to the dust; and, in executing the award of justice, I shall also"
84,"sink to rest. Then the appearance of death was distant, although the"
84,wish was ever present to my thoughts; and I often sat for hours
84,"motionless and speechless, wishing for some mighty revolution that"
84,might bury me and my destroyer in its ruins.
84,
84,The season of the assizes approached. I had already been three months
84,"in prison, and although I was still weak and in continual danger of a"
84,"relapse, I was obliged to travel nearly a hundred miles to the country"
84,town where the court was held. Mr. Kirwin charged himself with every
84,care of collecting witnesses and arranging my defence. I was spared
84,"the disgrace of appearing publicly as a criminal, as the case was not"
84,brought before the court that decides on life and death. The grand
84,"jury rejected the bill, on its being proved that I was on the Orkney"
84,Islands at the hour the body of my friend was found; and a fortnight
84,after my removal I was liberated from prison.
84,
84,My father was enraptured on finding me freed from the vexations of a
84,"criminal charge, that I was again allowed to breathe the fresh"
84,atmosphere and permitted to return to my native country. I did not
84,"participate in these feelings, for to me the walls of a dungeon or a"
84,"palace were alike hateful. The cup of life was poisoned for ever, and"
84,"although the sun shone upon me, as upon the happy and gay of heart, I"
84,"saw around me nothing but a dense and frightful darkness, penetrated by"
84,no light but the glimmer of two eyes that glared upon me. Sometimes
84,"they were the expressive eyes of Henry, languishing in death, the dark"
84,orbs nearly covered by the lids and the long black lashes that fringed
84,"them; sometimes it was the watery, clouded eyes of the monster, as I"
84,first saw them in my chamber at Ingolstadt.
84,
84,My father tried to awaken in me the feelings of affection. He talked
84,"of Geneva, which I should soon visit, of Elizabeth and Ernest; but"
84,"these words only drew deep groans from me. Sometimes, indeed, I felt a"
84,wish for happiness and thought with melancholy delight of my beloved
84,"cousin or longed, with a devouring _maladie du pays_, to see once more"
84,"the blue lake and rapid Rhone, that had been so dear to me in early"
84,childhood; but my general state of feeling was a torpor in which a
84,prison was as welcome a residence as the divinest scene in nature; and
84,these fits were seldom interrupted but by paroxysms of anguish and
84,despair. At these moments I often endeavoured to put an end to the
84,"existence I loathed, and it required unceasing attendance and vigilance"
84,to restrain me from committing some dreadful act of violence.
84,
84,"Yet one duty remained to me, the recollection of which finally"
84,triumphed over my selfish despair. It was necessary that I should
84,"return without delay to Geneva, there to watch over the lives of those"
84,"I so fondly loved and to lie in wait for the murderer, that if any"
84,"chance led me to the place of his concealment, or if he dared again to"
