gutenberg_id,text
84,your long silence.”
84,
84,"“Is that all, my dear Henry? How could you suppose that my first"
84,"thought would not fly towards those dear, dear friends whom I love and"
84,who are so deserving of my love?”
84,
84,"“If this is your present temper, my friend, you will perhaps be glad"
84,to see a letter that has been lying here some days for you; it is from
84,"your cousin, I believe.”"
84,
84,
84,
84,
84,Chapter 6
84,
84,
84,Clerval then put the following letter into my hands. It was from my
84,own Elizabeth:
84,
84,"“My dearest Cousin,"
84,
84,"“You have been ill, very ill, and even the constant letters of dear"
84,kind Henry are not sufficient to reassure me on your account. You are
84,"forbidden to write—to hold a pen; yet one word from you, dear Victor,"
84,is necessary to calm our apprehensions. For a long time I have thought
84,"that each post would bring this line, and my persuasions have"
84,restrained my uncle from undertaking a journey to Ingolstadt. I have
84,prevented his encountering the inconveniences and perhaps dangers of so
84,"long a journey, yet how often have I regretted not being able to"
84,perform it myself! I figure to myself that the task of attending on
84,"your sickbed has devolved on some mercenary old nurse, who could never"
84,guess your wishes nor minister to them with the care and affection of
84,your poor cousin. Yet that is over now: Clerval writes that indeed
84,you are getting better. I eagerly hope that you will confirm this
84,intelligence soon in your own handwriting.
84,
84,"“Get well—and return to us. You will find a happy, cheerful home and"
84,"friends who love you dearly. Your father’s health is vigorous, and he"
84,"asks but to see you, but to be assured that you are well; and not a"
84,care will ever cloud his benevolent countenance. How pleased you would
84,be to remark the improvement of our Ernest! He is now sixteen and full
84,of activity and spirit. He is desirous to be a true Swiss and to enter
84,"into foreign service, but we cannot part with him, at least until his"
84,elder brother returns to us. My uncle is not pleased with the idea of
84,"a military career in a distant country, but Ernest never had your"
84,powers of application. He looks upon study as an odious fetter; his
84,"time is spent in the open air, climbing the hills or rowing on the"
84,lake. I fear that he will become an idler unless we yield the point
84,and permit him to enter on the profession which he has selected.
84,
84,"“Little alteration, except the growth of our dear children, has taken"
84,place since you left us. The blue lake and snow-clad mountains—they
84,never change; and I think our placid home and our contented hearts are
84,regulated by the same immutable laws. My trifling occupations take up
84,"my time and amuse me, and I am rewarded for any exertions by seeing"
84,"none but happy, kind faces around me. Since you left us, but one"
84,change has taken place in our little household. Do you remember on
84,what occasion Justine Moritz entered our family? Probably you do not;
84,"I will relate her history, therefore in a few words. Madame Moritz,"
84,"her mother, was a widow with four children, of whom Justine was the"
84,"third. This girl had always been the favourite of her father, but"
84,"through a strange perversity, her mother could not endure her, and"
84,"after the death of M. Moritz, treated her very ill. My aunt observed"
84,"this, and when Justine was twelve years of age, prevailed on her mother"
84,to allow her to live at our house. The republican institutions of our
84,country have produced simpler and happier manners than those which
84,prevail in the great monarchies that surround it. Hence there is less
84,distinction between the several classes of its inhabitants; and the
84,"lower orders, being neither so poor nor so despised, their manners are"
84,more refined and moral. A servant in Geneva does not mean the same
84,"thing as a servant in France and England. Justine, thus received in"
84,"our family, learned the duties of a servant, a condition which, in our"
84,"fortunate country, does not include the idea of ignorance and a"
84,sacrifice of the dignity of a human being.
84,
84,"“Justine, you may remember, was a great favourite of yours; and I"
84,"recollect you once remarked that if you were in an ill humour, one"
84,"glance from Justine could dissipate it, for the same reason that"
84,Ariosto gives concerning the beauty of Angelica—she looked so
84,"frank-hearted and happy. My aunt conceived a great attachment for her,"
84,by which she was induced to give her an education superior to that
84,which she had at first intended. This benefit was fully repaid;
84,Justine was the most grateful little creature in the world: I do not
84,"mean that she made any professions I never heard one pass her lips, but"
84,you could see by her eyes that she almost adored her protectress.
84,"Although her disposition was gay and in many respects inconsiderate,"
84,yet she paid the greatest attention to every gesture of my aunt. She
84,thought her the model of all excellence and endeavoured to imitate her
84,"phraseology and manners, so that even now she often reminds me of her."
84,
84,“When my dearest aunt died every one was too much occupied in their own
84,"grief to notice poor Justine, who had attended her during her illness"
84,with the most anxious affection. Poor Justine was very ill; but other
84,trials were reserved for her.
84,
84,"“One by one, her brothers and sister died; and her mother, with the"
84,"exception of her neglected daughter, was left childless. The"
84,conscience of the woman was troubled; she began to think that the
84,deaths of her favourites was a judgement from heaven to chastise her
84,partiality. She was a Roman Catholic; and I believe her confessor
84,"confirmed the idea which she had conceived. Accordingly, a few months"
84,"after your departure for Ingolstadt, Justine was called home by her"
84,repentant mother. Poor girl! She wept when she quitted our house; she
84,was much altered since the death of my aunt; grief had given softness
84,"and a winning mildness to her manners, which had before been remarkable"
84,for vivacity. Nor was her residence at her mother’s house of a nature
84,to restore her gaiety. The poor woman was very vacillating in her
84,"repentance. She sometimes begged Justine to forgive her unkindness,"
84,but much oftener accused her of having caused the deaths of her
84,brothers and sister. Perpetual fretting at length threw Madame Moritz
84,"into a decline, which at first increased her irritability, but she is"
84,"now at peace for ever. She died on the first approach of cold weather,"
84,at the beginning of this last winter. Justine has just returned to us;
84,"and I assure you I love her tenderly. She is very clever and gentle,"
84,"and extremely pretty; as I mentioned before, her mien and her"
84,expression continually remind me of my dear aunt.
84,
84,"“I must say also a few words to you, my dear cousin, of little darling"
84,"William. I wish you could see him; he is very tall of his age, with"
84,"sweet laughing blue eyes, dark eyelashes, and curling hair. When he"
84,"smiles, two little dimples appear on each cheek, which are rosy with"
84,"health. He has already had one or two little _wives,_ but Louisa Biron"
84,"is his favourite, a pretty little girl of five years of age."
84,
84,"“Now, dear Victor, I dare say you wish to be indulged in a little"
84,gossip concerning the good people of Geneva. The pretty Miss Mansfield
84,has already received the congratulatory visits on her approaching
84,"marriage with a young Englishman, John Melbourne, Esq. Her ugly"
84,"sister, Manon, married M. Duvillard, the rich banker, last autumn. Your"
84,"favourite schoolfellow, Louis Manoir, has suffered several misfortunes"
84,since the departure of Clerval from Geneva. But he has already
84,"recovered his spirits, and is reported to be on the point of marrying a"
84,"lively pretty Frenchwoman, Madame Tavernier. She is a widow, and much"
84,"older than Manoir; but she is very much admired, and a favourite with"
84,everybody.
84,
84,"“I have written myself into better spirits, dear cousin; but my anxiety"
84,"returns upon me as I conclude. Write, dearest Victor,—one line—one"
84,word will be a blessing to us. Ten thousand thanks to Henry for his
84,"kindness, his affection, and his many letters; we are sincerely"
84,"grateful. Adieu! my cousin; take care of yourself; and, I entreat"
84,"you, write!"
84,
84,“Elizabeth Lavenza.
84,
84,
84,"“Geneva, March 18th, 17—.”"
84,
84,
84,
84,"“Dear, dear Elizabeth!” I exclaimed, when I had read her"
84,letter: “I will write instantly and relieve them from the anxiety
84,"they must feel.” I wrote, and this exertion greatly fatigued me; but"
84,"my convalescence had commenced, and proceeded regularly. In another"
84,fortnight I was able to leave my chamber.
84,
84,One of my first duties on my recovery was to introduce Clerval to the
84,"several professors of the university. In doing this, I underwent a"
84,"kind of rough usage, ill befitting the wounds that my mind had"
84,"sustained. Ever since the fatal night, the end of my labours, and the"
84,"beginning of my misfortunes, I had conceived a violent antipathy even"
84,to the name of natural philosophy. When I was otherwise quite restored
84,"to health, the sight of a chemical instrument would renew all the agony"
84,"of my nervous symptoms. Henry saw this, and had removed all my"
84,apparatus from my view. He had also changed my apartment; for he
84,perceived that I had acquired a dislike for the room which had
84,previously been my laboratory. But these cares of Clerval were made of
84,no avail when I visited the professors. M. Waldman inflicted torture
84,"when he praised, with kindness and warmth, the astonishing progress I"
84,had made in the sciences. He soon perceived that I disliked the
84,"subject; but not guessing the real cause, he attributed my feelings to"
84,"modesty, and changed the subject from my improvement, to the science"
84,"itself, with a desire, as I evidently saw, of drawing me out. What"
84,"could I do? He meant to please, and he tormented me. I felt as if he"
84,"had placed carefully, one by one, in my view those instruments which"
84,were to be afterwards used in putting me to a slow and cruel death. I
84,"writhed under his words, yet dared not exhibit the pain I felt."
84,"Clerval, whose eyes and feelings were always quick in discerning the"
84,"sensations of others, declined the subject, alleging, in excuse, his"
84,total ignorance; and the conversation took a more general turn. I
84,"thanked my friend from my heart, but I did not speak. I saw plainly"
84,"that he was surprised, but he never attempted to draw my secret from"
84,me; and although I loved him with a mixture of affection and reverence
84,"that knew no bounds, yet I could never persuade myself to confide in"
84,"him that event which was so often present to my recollection, but which"
84,I feared the detail to another would only impress more deeply.
84,
84,"M. Krempe was not equally docile; and in my condition at that time, of"
84,"almost insupportable sensitiveness, his harsh blunt encomiums gave me even"
84,more pain than the benevolent approbation of M. Waldman. “D—n
84,"the fellow!” cried he; “why, M. Clerval, I assure you he has"
84,"outstript us all. Ay, stare if you please; but it is nevertheless true. A"
84,"youngster who, but a few years ago, believed in Cornelius Agrippa as firmly"
84,"as in the gospel, has now set himself at the head of the university; and if"
84,"he is not soon pulled down, we shall all be out of countenance.—Ay,"
84,"ay,” continued he, observing my face expressive of suffering,"
84,“M. Frankenstein is modest; an excellent quality in a young man.
84,"Young men should be diffident of themselves, you know, M. Clerval: I was"
84,myself when young; but that wears out in a very short time.”
84,
84,"M. Krempe had now commenced an eulogy on himself, which happily turned"
84,the conversation from a subject that was so annoying to me.
84,
84,Clerval had never sympathised in my tastes for natural science; and his
84,literary pursuits differed wholly from those which had occupied me. He
84,came to the university with the design of making himself complete
84,"master of the oriental languages, and thus he should open a field for"
84,the plan of life he had marked out for himself. Resolved to pursue no
84,"inglorious career, he turned his eyes toward the East, as affording"
84,"scope for his spirit of enterprise. The Persian, Arabic, and Sanskrit"
84,"languages engaged his attention, and I was easily induced to enter on"
84,"the same studies. Idleness had ever been irksome to me, and now that I"
84,"wished to fly from reflection, and hated my former studies, I felt"
84,"great relief in being the fellow-pupil with my friend, and found not"
84,only instruction but consolation in the works of the orientalists. I
84,"did not, like him, attempt a critical knowledge of their dialects, for"
84,I did not contemplate making any other use of them than temporary
84,"amusement. I read merely to understand their meaning, and they well"
84,"repaid my labours. Their melancholy is soothing, and their joy"
84,"elevating, to a degree I never experienced in studying the authors of"
84,"any other country. When you read their writings, life appears to"
84,"consist in a warm sun and a garden of roses,—in the smiles and frowns"
84,"of a fair enemy, and the fire that consumes your own heart. How"
84,different from the manly and heroical poetry of Greece and Rome!
84,
84,"Summer passed away in these occupations, and my return to Geneva was"
84,fixed for the latter end of autumn; but being delayed by several
84,"accidents, winter and snow arrived, the roads were deemed impassable,"
84,and my journey was retarded until the ensuing spring. I felt this
84,delay very bitterly; for I longed to see my native town and my beloved
84,"friends. My return had only been delayed so long, from an"
84,"unwillingness to leave Clerval in a strange place, before he had become"
84,"acquainted with any of its inhabitants. The winter, however, was spent"
84,"cheerfully; and although the spring was uncommonly late, when it came"
84,its beauty compensated for its dilatoriness.
84,
84,"The month of May had already commenced, and I expected the letter daily"
84,"which was to fix the date of my departure, when Henry proposed a"
84,"pedestrian tour in the environs of Ingolstadt, that I might bid a"
84,personal farewell to the country I had so long inhabited. I acceded
84,"with pleasure to this proposition: I was fond of exercise, and Clerval"
84,had always been my favourite companion in the ramble of this nature
84,that I had taken among the scenes of my native country.
84,
84,We passed a fortnight in these perambulations: my health and spirits
84,"had long been restored, and they gained additional strength from the"
84,"salubrious air I breathed, the natural incidents of our progress, and"
84,the conversation of my friend. Study had before secluded me from the
84,"intercourse of my fellow-creatures, and rendered me unsocial; but"
84,Clerval called forth the better feelings of my heart; he again taught
84,"me to love the aspect of nature, and the cheerful faces of children."
84,"Excellent friend! how sincerely you did love me, and endeavour to"
84,elevate my mind until it was on a level with your own. A selfish
84,"pursuit had cramped and narrowed me, until your gentleness and"
84,affection warmed and opened my senses; I became the same happy creature
84,"who, a few years ago, loved and beloved by all, had no sorrow or care."
84,"When happy, inanimate nature had the power of bestowing on me the most"
84,delightful sensations. A serene sky and verdant fields filled me with
84,ecstasy. The present season was indeed divine; the flowers of spring
84,"bloomed in the hedges, while those of summer were already in bud. I"
84,was undisturbed by thoughts which during the preceding year had pressed
84,"upon me, notwithstanding my endeavours to throw them off, with an"
84,invincible burden.
84,
84,"Henry rejoiced in my gaiety, and sincerely sympathised in my feelings: he"
84,"exerted himself to amuse me, while he expressed the sensations that filled"
84,his soul. The resources of his mind on this occasion were truly
84,"astonishing: his conversation was full of imagination; and very often, in"
84,"imitation of the Persian and Arabic writers, he invented tales of wonderful"
84,"fancy and passion. At other times he repeated my favourite poems, or drew"
84,"me out into arguments, which he supported with great ingenuity."
84,
84,We returned to our college on a Sunday afternoon: the peasants were
84,"dancing, and every one we met appeared gay and happy. My own spirits were"
84,"high, and I bounded along with feelings of unbridled joy and hilarity."
84,
84,
84,
84,
84,Chapter 7
84,
84,
84,"On my return, I found the following letter from my father:—"
84,
84,"“My dear Victor,"
84,
84,“You have probably waited impatiently for a letter to fix the date of
84,your return to us; and I was at first tempted to write only a few
84,"lines, merely mentioning the day on which I should expect you. But"
84,"that would be a cruel kindness, and I dare not do it. What would be"
84,"your surprise, my son, when you expected a happy and glad welcome, to"
84,"behold, on the contrary, tears and wretchedness? And how, Victor, can"
84,I relate our misfortune? Absence cannot have rendered you callous to
84,our joys and griefs; and how shall I inflict pain on my long absent
84,"son? I wish to prepare you for the woeful news, but I know it is"
84,impossible; even now your eye skims over the page to seek the words
84,which are to convey to you the horrible tidings.
84,
84,"“William is dead!—that sweet child, whose smiles delighted and warmed"
84,"my heart, who was so gentle, yet so gay! Victor, he is murdered!"
84,
84,“I will not attempt to console you; but will simply relate the
84,circumstances of the transaction.
84,
84,"“Last Thursday (May 7th), I, my niece, and your two brothers, went to"
84,"walk in Plainpalais. The evening was warm and serene, and we prolonged"
84,our walk farther than usual. It was already dusk before we thought of
84,"returning; and then we discovered that William and Ernest, who had gone"
84,"on before, were not to be found. We accordingly rested on a seat until"
84,"they should return. Presently Ernest came, and enquired if we had seen"
84,"his brother; he said, that he had been playing with him, that William"
84,"had run away to hide himself, and that he vainly sought for him, and"
84,"afterwards waited for a long time, but that he did not return."
84,
84,"“This account rather alarmed us, and we continued to search for him"
84,"until night fell, when Elizabeth conjectured that he might have"
84,"returned to the house. He was not there. We returned again, with"
84,"torches; for I could not rest, when I thought that my sweet boy had"
84,"lost himself, and was exposed to all the damps and dews of night;"
84,Elizabeth also suffered extreme anguish. About five in the morning I
84,"discovered my lovely boy, whom the night before I had seen blooming and"
84,"active in health, stretched on the grass livid and motionless; the"
84,print of the murder’s finger was on his neck.
84,
84,"“He was conveyed home, and the anguish that was visible in my"
84,countenance betrayed the secret to Elizabeth. She was very earnest to
84,"see the corpse. At first I attempted to prevent her but she persisted,"
84,"and entering the room where it lay, hastily examined the neck of the"
84,"victim, and clasping her hands exclaimed, ‘O God! I have murdered my"
84,darling child!’
84,
84,"“She fainted, and was restored with extreme difficulty. When she again"
84,"lived, it was only to weep and sigh. She told me, that that same"
84,evening William had teased her to let him wear a very valuable
84,"miniature that she possessed of your mother. This picture is gone, and"
84,was doubtless the temptation which urged the murderer to the deed. We
84,"have no trace of him at present, although our exertions to discover him"
84,are unremitted; but they will not restore my beloved William!
84,
84,"“Come, dearest Victor; you alone can console Elizabeth. She weeps"
84,"continually, and accuses herself unjustly as the cause of his death;"
84,her words pierce my heart. We are all unhappy; but will not that be an
84,"additional motive for you, my son, to return and be our comforter?"
84,"Your dear mother! Alas, Victor! I now say, Thank God she did not live"
84,"to witness the cruel, miserable death of her youngest darling!"
84,
84,"“Come, Victor; not brooding thoughts of vengeance against the assassin,"
84,"but with feelings of peace and gentleness, that will heal, instead of"
84,"festering, the wounds of our minds. Enter the house of mourning, my"
84,"friend, but with kindness and affection for those who love you, and not"
84,with hatred for your enemies.
84,
84,"“Your affectionate and afflicted father,"
84,
84,“Alphonse Frankenstein.
84,
84,
84,
84,"“Geneva, May 12th, 17—.”"
84,
84,
84,
84,"Clerval, who had watched my countenance as I read this letter, was"
84,surprised to observe the despair that succeeded the joy I at first
84,expressed on receiving new from my friends. I threw the letter on the
84,"table, and covered my face with my hands."
84,
84,"“My dear Frankenstein,” exclaimed Henry, when he perceived me"
84,"weep with bitterness, “are you always to be unhappy? My dear friend,"
84,what has happened?”
84,
84,"I motioned him to take up the letter, while I walked up and down the"
84,room in the extremest agitation. Tears also gushed from the eyes of
84,"Clerval, as he read the account of my misfortune."
84,
84,"“I can offer you no consolation, my friend,” said he;"
84,“your disaster is irreparable. What do you intend to do?”
84,
84,"“To go instantly to Geneva: come with me, Henry, to order the horses.”"
84,
84,"During our walk, Clerval endeavoured to say a few words of consolation;"
84,"he could only express his heartfelt sympathy. “Poor William!” said he,"
84,"“dear lovely child, he now sleeps with his angel mother! Who that had"
84,"seen him bright and joyous in his young beauty, but must weep over his"
84,untimely loss! To die so miserably; to feel the murderer’s grasp! How
84,much more a murdered that could destroy radiant innocence! Poor little
84,"fellow! one only consolation have we; his friends mourn and weep, but"
84,"he is at rest. The pang is over, his sufferings are at an end for ever."
84,"A sod covers his gentle form, and he knows no pain. He can no longer"
84,be a subject for pity; we must reserve that for his miserable
84,survivors.”
84,
84,Clerval spoke thus as we hurried through the streets; the words
84,impressed themselves on my mind and I remembered them afterwards in
84,"solitude. But now, as soon as the horses arrived, I hurried into a"
84,"cabriolet, and bade farewell to my friend."
84,
84,"My journey was very melancholy. At first I wished to hurry on, for I longed"
84,to console and sympathise with my loved and sorrowing friends; but when I
84,"drew near my native town, I slackened my progress. I could hardly sustain"
84,the multitude of feelings that crowded into my mind. I passed through
84,"scenes familiar to my youth, but which I had not seen for nearly six years."
84,How altered every thing might be during that time! One sudden and
84,desolating change had taken place; but a thousand little circumstances
84,"might have by degrees worked other alterations, which, although they were"
84,"done more tranquilly, might not be the less decisive. Fear overcame me; I"
84,"dared no advance, dreading a thousand nameless evils that made me tremble,"
84,although I was unable to define them.
84,
84,"I remained two days at Lausanne, in this painful state of mind. I"
84,contemplated the lake: the waters were placid; all around was calm; and the
84,"snowy mountains, “the palaces of nature,” were not changed. By"
84,"degrees the calm and heavenly scene restored me, and I continued my journey"
84,towards Geneva.
84,
84,"The road ran by the side of the lake, which became narrower as I"
84,approached my native town. I discovered more distinctly the black
84,"sides of Jura, and the bright summit of Mont Blanc. I wept like a"
84,child. “Dear mountains! my own beautiful lake! how do you welcome your
84,wanderer? Your summits are clear; the sky and lake are blue and
84,"placid. Is this to prognosticate peace, or to mock at my unhappiness?”"
84,
84,"I fear, my friend, that I shall render myself tedious by dwelling on"
84,these preliminary circumstances; but they were days of comparative
84,"happiness, and I think of them with pleasure. My country, my beloved"
84,country! who but a native can tell the delight I took in again
84,"beholding thy streams, thy mountains, and, more than all, thy lovely"
84,lake!
84,
84,"Yet, as I drew nearer home, grief and fear again overcame me. Night also"
84,"closed around; and when I could hardly see the dark mountains, I felt still"
84,"more gloomily. The picture appeared a vast and dim scene of evil, and I"
84,foresaw obscurely that I was destined to become the most wretched of human
84,"beings. Alas! I prophesied truly, and failed only in one single"
84,"circumstance, that in all the misery I imagined and dreaded, I did not"
84,conceive the hundredth part of the anguish I was destined to endure.
84,
84,It was completely dark when I arrived in the environs of Geneva; the gates
84,of the town were already shut; and I was obliged to pass the night at
84,"Secheron, a village at the distance of half a league from the city. The sky"
