gutenberg_id,text
84,“A considerable period elapsed before I discovered one of the causes of
84,"the uneasiness of this amiable family: it was poverty, and they"
84,suffered that evil in a very distressing degree. Their nourishment
84,consisted entirely of the vegetables of their garden and the milk of
84,"one cow, which gave very little during the winter, when its masters"
84,"could scarcely procure food to support it. They often, I believe,"
84,"suffered the pangs of hunger very poignantly, especially the two"
84,"younger cottagers, for several times they placed food before the old"
84,man when they reserved none for themselves.
84,
84,"“This trait of kindness moved me sensibly. I had been accustomed,"
84,"during the night, to steal a part of their store for my own"
84,"consumption, but when I found that in doing this I inflicted pain on"
84,"the cottagers, I abstained and satisfied myself with berries, nuts, and"
84,roots which I gathered from a neighbouring wood.
84,
84,“I discovered also another means through which I was enabled to assist
84,their labours. I found that the youth spent a great part of each day
84,"in collecting wood for the family fire, and during the night I often"
84,"took his tools, the use of which I quickly discovered, and brought home"
84,firing sufficient for the consumption of several days.
84,
84,"“I remember, the first time that I did this, the young woman, when she"
84,"opened the door in the morning, appeared greatly astonished on seeing a great"
84,"pile of wood on the outside. She uttered some words in a loud voice, and the"
84,"youth joined her, who also expressed surprise. I observed, with pleasure,"
84,"that he did not go to the forest that day, but spent it in repairing the"
84,cottage and cultivating the garden.
84,
84,“By degrees I made a discovery of still greater moment. I found that
84,these people possessed a method of communicating their experience and
84,feelings to one another by articulate sounds. I perceived that the words
84,"they spoke sometimes produced pleasure or pain, smiles or sadness, in the"
84,"minds and countenances of the hearers. This was indeed a godlike science,"
84,and I ardently desired to become acquainted with it. But I was baffled in
84,"every attempt I made for this purpose. Their pronunciation was quick, and"
84,"the words they uttered, not having any apparent connection with visible"
84,"objects, I was unable to discover any clue by which I could unravel the"
84,"mystery of their reference. By great application, however, and after having"
84,"remained during the space of several revolutions of the moon in my hovel, I"
84,discovered the names that were given to some of the most familiar objects of
84,"discourse; I learned and applied the words, _fire, milk, bread,_ and"
84,_wood._ I learned also the names of the cottagers themselves. The youth
84,"and his companion had each of them several names, but the old man had only"
84,"one, which was _father._ The girl was called _sister_ or"
84,"_Agatha,_ and the youth _Felix, brother,_ or _son_. I cannot"
84,describe the delight I felt when I learned the ideas appropriated to each of
84,these sounds and was able to pronounce them. I distinguished several other
84,"words without being able as yet to understand or apply them, such as _good,"
84,"dearest, unhappy._"
84,
84,“I spent the winter in this manner. The gentle manners and beauty of
84,"the cottagers greatly endeared them to me; when they were unhappy, I"
84,"felt depressed; when they rejoiced, I sympathised in their joys. I saw"
84,"few human beings besides them, and if any other happened to enter the"
84,"cottage, their harsh manners and rude gait only enhanced to me the"
84,"superior accomplishments of my friends. The old man, I could perceive,"
84,"often endeavoured to encourage his children, as sometimes I found that"
84,"he called them, to cast off their melancholy. He would talk in a"
84,"cheerful accent, with an expression of goodness that bestowed pleasure"
84,"even upon me. Agatha listened with respect, her eyes sometimes filled"
84,"with tears, which she endeavoured to wipe away unperceived; but I"
84,generally found that her countenance and tone were more cheerful after
84,having listened to the exhortations of her father. It was not thus
84,"with Felix. He was always the saddest of the group, and even to my"
84,"unpractised senses, he appeared to have suffered more deeply than his"
84,"friends. But if his countenance was more sorrowful, his voice was more"
84,"cheerful than that of his sister, especially when he addressed the old"
84,man.
84,
84,"“I could mention innumerable instances which, although slight, marked"
84,the dispositions of these amiable cottagers. In the midst of poverty
84,"and want, Felix carried with pleasure to his sister the first little"
84,white flower that peeped out from beneath the snowy ground. Early in
84,"the morning, before she had risen, he cleared away the snow that"
84,"obstructed her path to the milk-house, drew water from the well, and"
84,"brought the wood from the outhouse, where, to his perpetual"
84,"astonishment, he found his store always replenished by an invisible"
84,"hand. In the day, I believe, he worked sometimes for a neighbouring"
84,"farmer, because he often went forth and did not return until dinner,"
84,"yet brought no wood with him. At other times he worked in the garden,"
84,"but as there was little to do in the frosty season, he read to the old"
84,man and Agatha.
84,
84,"“This reading had puzzled me extremely at first, but by degrees I"
84,discovered that he uttered many of the same sounds when he read as when
84,"he talked. I conjectured, therefore, that he found on the paper signs"
84,"for speech which he understood, and I ardently longed to comprehend"
84,these also; but how was that possible when I did not even understand
84,"the sounds for which they stood as signs? I improved, however,"
84,"sensibly in this science, but not sufficiently to follow up any kind of"
84,"conversation, although I applied my whole mind to the endeavour, for I"
84,"easily perceived that, although I eagerly longed to discover myself to"
84,"the cottagers, I ought not to make the attempt until I had first become"
84,"master of their language, which knowledge might enable me to make them"
84,"overlook the deformity of my figure, for with this also the contrast"
84,perpetually presented to my eyes had made me acquainted.
84,
84,"“I had admired the perfect forms of my cottagers—their grace, beauty,"
84,and delicate complexions; but how was I terrified when I viewed myself
84,"in a transparent pool! At first I started back, unable to believe that"
84,it was indeed I who was reflected in the mirror; and when I became
84,"fully convinced that I was in reality the monster that I am, I was"
84,filled with the bitterest sensations of despondence and mortification.
84,Alas! I did not yet entirely know the fatal effects of this miserable
84,deformity.
84,
84,"“As the sun became warmer and the light of day longer, the snow"
84,"vanished, and I beheld the bare trees and the black earth. From this"
84,"time Felix was more employed, and the heart-moving indications of"
84,"impending famine disappeared. Their food, as I afterwards found, was"
84,"coarse, but it was wholesome; and they procured a sufficiency of it."
84,"Several new kinds of plants sprang up in the garden, which they"
84,dressed; and these signs of comfort increased daily as the season
84,advanced.
84,
84,"“The old man, leaning on his son, walked each day at noon, when it did"
84,"not rain, as I found it was called when the heavens poured forth its"
84,"waters. This frequently took place, but a high wind quickly dried the"
84,"earth, and the season became far more pleasant than it had been."
84,
84,“My mode of life in my hovel was uniform. During the morning I
84,"attended the motions of the cottagers, and when they were dispersed in"
84,"various occupations, I slept; the remainder of the day was spent in"
84,"observing my friends. When they had retired to rest, if there was any"
84,"moon or the night was star-light, I went into the woods and collected"
84,"my own food and fuel for the cottage. When I returned, as often as it"
84,"was necessary, I cleared their path from the snow and performed those"
84,offices that I had seen done by Felix. I afterwards found that these
84,"labours, performed by an invisible hand, greatly astonished them; and"
84,"once or twice I heard them, on these occasions, utter the words _good"
84,"spirit, wonderful_; but I did not then understand the signification"
84,of these terms.
84,
84,"“My thoughts now became more active, and I longed to discover the"
84,motives and feelings of these lovely creatures; I was inquisitive to
84,know why Felix appeared so miserable and Agatha so sad. I thought
84,(foolish wretch!) that it might be in my power to restore happiness to
84,"these deserving people. When I slept or was absent, the forms of the"
84,"venerable blind father, the gentle Agatha, and the excellent Felix"
84,flitted before me. I looked upon them as superior beings who would be
84,the arbiters of my future destiny. I formed in my imagination a
84,"thousand pictures of presenting myself to them, and their reception of"
84,"me. I imagined that they would be disgusted, until, by my gentle"
84,"demeanour and conciliating words, I should first win their favour and"
84,afterwards their love.
84,
84,“These thoughts exhilarated me and led me to apply with fresh ardour to
84,"the acquiring the art of language. My organs were indeed harsh, but"
84,supple; and although my voice was very unlike the soft music of their
84,"tones, yet I pronounced such words as I understood with tolerable ease."
84,It was as the ass and the lap-dog; yet surely the gentle ass whose
84,"intentions were affectionate, although his manners were rude, deserved"
84,better treatment than blows and execration.
84,
84,“The pleasant showers and genial warmth of spring greatly altered the
84,aspect of the earth. Men who before this change seemed to have been
84,hid in caves dispersed themselves and were employed in various arts of
84,"cultivation. The birds sang in more cheerful notes, and the leaves"
84,"began to bud forth on the trees. Happy, happy earth! Fit habitation"
84,"for gods, which, so short a time before, was bleak, damp, and"
84,unwholesome. My spirits were elevated by the enchanting appearance of
84,"nature; the past was blotted from my memory, the present was tranquil,"
84,and the future gilded by bright rays of hope and anticipations of joy.”
84,
84,
84,
84,
84,Chapter 13
84,
84,
84,“I now hasten to the more moving part of my story. I shall relate
84,"events that impressed me with feelings which, from what I had been,"
84,have made me what I am.
84,
84,“Spring advanced rapidly; the weather became fine and the skies
84,cloudless. It surprised me that what before was desert and gloomy
84,should now bloom with the most beautiful flowers and verdure. My
84,senses were gratified and refreshed by a thousand scents of delight and
84,a thousand sights of beauty.
84,
84,"“It was on one of these days, when my cottagers periodically rested"
84,"from labour—the old man played on his guitar, and the children"
84,listened to him—that I observed the countenance of Felix was
84,"melancholy beyond expression; he sighed frequently, and once his father"
84,"paused in his music, and I conjectured by his manner that he inquired"
84,"the cause of his son’s sorrow. Felix replied in a cheerful accent, and"
84,the old man was recommencing his music when someone tapped at the door.
84,
84,"“It was a lady on horseback, accompanied by a country-man as a guide."
84,The lady was dressed in a dark suit and covered with a thick black
84,"veil. Agatha asked a question, to which the stranger only replied by"
84,"pronouncing, in a sweet accent, the name of Felix. Her voice was"
84,"musical but unlike that of either of my friends. On hearing this word,"
84,"Felix came up hastily to the lady, who, when she saw him, threw up her"
84,"veil, and I beheld a countenance of angelic beauty and expression. Her"
84,"hair of a shining raven black, and curiously braided; her eyes were"
84,"dark, but gentle, although animated; her features of a regular"
84,"proportion, and her complexion wondrously fair, each cheek tinged with"
84,a lovely pink.
84,
84,"“Felix seemed ravished with delight when he saw her, every trait of"
84,"sorrow vanished from his face, and it instantly expressed a degree of"
84,"ecstatic joy, of which I could hardly have believed it capable; his"
84,"eyes sparkled, as his cheek flushed with pleasure; and at that moment I"
84,thought him as beautiful as the stranger. She appeared affected by
84,"different feelings; wiping a few tears from her lovely eyes, she held"
84,"out her hand to Felix, who kissed it rapturously and called her, as"
84,"well as I could distinguish, his sweet Arabian. She did not appear to"
84,"understand him, but smiled. He assisted her to dismount, and"
84,"dismissing her guide, conducted her into the cottage. Some"
84,"conversation took place between him and his father, and the young"
84,"stranger knelt at the old man’s feet and would have kissed his hand,"
84,but he raised her and embraced her affectionately.
84,
84,“I soon perceived that although the stranger uttered articulate sounds
84,"and appeared to have a language of her own, she was neither understood"
84,by nor herself understood the cottagers. They made many signs which I
84,"did not comprehend, but I saw that her presence diffused gladness"
84,"through the cottage, dispelling their sorrow as the sun dissipates the"
84,morning mists. Felix seemed peculiarly happy and with smiles of
84,"delight welcomed his Arabian. Agatha, the ever-gentle Agatha, kissed"
84,"the hands of the lovely stranger, and pointing to her brother, made"
84,signs which appeared to me to mean that he had been sorrowful until she
84,"came. Some hours passed thus, while they, by their countenances,"
84,"expressed joy, the cause of which I did not comprehend. Presently I"
84,"found, by the frequent recurrence of some sound which the stranger"
84,"repeated after them, that she was endeavouring to learn their language;"
84,and the idea instantly occurred to me that I should make use of the
84,same instructions to the same end. The stranger learned about twenty
84,"words at the first lesson; most of them, indeed, were those which I had"
84,"before understood, but I profited by the others."
84,
84,"“As night came on, Agatha and the Arabian retired early. When they"
84,"separated Felix kissed the hand of the stranger and said, ‘Good night"
84,"sweet Safie.’ He sat up much longer, conversing with his father, and"
84,by the frequent repetition of her name I conjectured that their lovely
84,guest was the subject of their conversation. I ardently desired to
84,"understand them, and bent every faculty towards that purpose, but found"
84,it utterly impossible.
84,
84,"“The next morning Felix went out to his work, and after the usual"
84,"occupations of Agatha were finished, the Arabian sat at the feet of the"
84,"old man, and taking his guitar, played some airs so entrancingly"
84,beautiful that they at once drew tears of sorrow and delight from my
84,"eyes. She sang, and her voice flowed in a rich cadence, swelling or"
84,dying away like a nightingale of the woods.
84,
84,"“When she had finished, she gave the guitar to Agatha, who at first"
84,"declined it. She played a simple air, and her voice accompanied it in"
84,"sweet accents, but unlike the wondrous strain of the stranger. The old"
84,man appeared enraptured and said some words which Agatha endeavoured to
84,"explain to Safie, and by which he appeared to wish to express that she"
84,bestowed on him the greatest delight by her music.
84,
84,"“The days now passed as peaceably as before, with the sole alteration"
84,that joy had taken place of sadness in the countenances of my friends.
84,Safie was always gay and happy; she and I improved rapidly in the
84,"knowledge of language, so that in two months I began to comprehend most"
84,of the words uttered by my protectors.
84,
84,"“In the meanwhile also the black ground was covered with herbage, and"
84,"the green banks interspersed with innumerable flowers, sweet to the"
84,"scent and the eyes, stars of pale radiance among the moonlight woods;"
84,"the sun became warmer, the nights clear and balmy; and my nocturnal"
84,"rambles were an extreme pleasure to me, although they were considerably"
84,"shortened by the late setting and early rising of the sun, for I never"
84,"ventured abroad during daylight, fearful of meeting with the same"
84,treatment I had formerly endured in the first village which I entered.
84,
84,"“My days were spent in close attention, that I might more speedily"
84,master the language; and I may boast that I improved more rapidly than
84,"the Arabian, who understood very little and conversed in broken"
84,"accents, whilst I comprehended and could imitate almost every word that"
84,was spoken.
84,
84,"“While I improved in speech, I also learned the science of letters as"
84,"it was taught to the stranger, and this opened before me a wide field"
84,for wonder and delight.
84,
84,“The book from which Felix instructed Safie was Volney’s _Ruins
84,of Empires_. I should not have understood the purport of this book had not
84,"Felix, in reading it, given very minute explanations. He had chosen this"
84,"work, he said, because the declamatory style was framed in imitation of the"
84,Eastern authors. Through this work I obtained a cursory knowledge of history
84,and a view of the several empires at present existing in the world; it gave
84,"me an insight into the manners, governments, and religions of the different"
84,"nations of the earth. I heard of the slothful Asiatics, of the stupendous"
84,"genius and mental activity of the Grecians, of the wars and wonderful virtue"
84,of the early Romans—of their subsequent degenerating—of the
84,"decline of that mighty empire, of chivalry, Christianity, and kings. I heard"
84,of the discovery of the American hemisphere and wept with Safie over the
84,hapless fate of its original inhabitants.
84,
84,“These wonderful narrations inspired me with strange feelings. Was
84,"man, indeed, at once so powerful, so virtuous and magnificent, yet so"
84,vicious and base? He appeared at one time a mere scion of the evil
84,principle and at another as all that can be conceived of noble and
84,godlike. To be a great and virtuous man appeared the highest honour
84,"that can befall a sensitive being; to be base and vicious, as many on"
84,"record have been, appeared the lowest degradation, a condition more"
84,abject than that of the blind mole or harmless worm. For a long time I
84,"could not conceive how one man could go forth to murder his fellow, or"
84,even why there were laws and governments; but when I heard details of
84,"vice and bloodshed, my wonder ceased and I turned away with disgust and"
84,loathing.
84,
84,“Every conversation of the cottagers now opened new wonders to me.
84,While I listened to the instructions which Felix bestowed upon the
84,"Arabian, the strange system of human society was explained to me. I"
84,"heard of the division of property, of immense wealth and squalid"
84,"poverty, of rank, descent, and noble blood."
84,
84,“The words induced me to turn towards myself. I learned that the
84,possessions most esteemed by your fellow creatures were high and
84,unsullied descent united with riches. A man might be respected with
84,"only one of these advantages, but without either he was considered,"
84,"except in very rare instances, as a vagabond and a slave, doomed to"
84,waste his powers for the profits of the chosen few! And what was I? Of
84,"my creation and creator I was absolutely ignorant, but I knew that I"
84,"possessed no money, no friends, no kind of property. I was, besides,"
84,endued with a figure hideously deformed and loathsome; I was not even
84,of the same nature as man. I was more agile than they and could
84,subsist upon coarser diet; I bore the extremes of heat and cold with
84,less injury to my frame; my stature far exceeded theirs. When I looked
84,"around I saw and heard of none like me. Was I, then, a monster, a blot"
84,"upon the earth, from which all men fled and whom all men disowned?"
84,
84,“I cannot describe to you the agony that these reflections inflicted
84,"upon me; I tried to dispel them, but sorrow only increased with"
84,"knowledge. Oh, that I had for ever remained in my native wood, nor"
84,"known nor felt beyond the sensations of hunger, thirst, and heat!"
84,
84,“Of what a strange nature is knowledge! It clings to the mind when it
84,has once seized on it like a lichen on the rock. I wished sometimes to
84,"shake off all thought and feeling, but I learned that there was but one"
84,"means to overcome the sensation of pain, and that was death—a state"
84,which I feared yet did not understand. I admired virtue and good
84,feelings and loved the gentle manners and amiable qualities of my
84,"cottagers, but I was shut out from intercourse with them, except"
84,"through means which I obtained by stealth, when I was unseen and"
84,"unknown, and which rather increased than satisfied the desire I had of"
84,becoming one among my fellows. The gentle words of Agatha and the
84,animated smiles of the charming Arabian were not for me. The mild
84,exhortations of the old man and the lively conversation of the loved
84,"Felix were not for me. Miserable, unhappy wretch!"
84,
84,“Other lessons were impressed upon me even more deeply. I heard of the
84,"difference of sexes, and the birth and growth of children, how the"
84,"father doted on the smiles of the infant, and the lively sallies of the"
84,"older child, how all the life and cares of the mother were wrapped up"
84,"in the precious charge, how the mind of youth expanded and gained"
84,"knowledge, of brother, sister, and all the various relationships which"
84,bind one human being to another in mutual bonds.
84,
84,“But where were my friends and relations? No father had watched my
84,"infant days, no mother had blessed me with smiles and caresses; or if"
84,"they had, all my past life was now a blot, a blind vacancy in which I"
84,distinguished nothing. From my earliest remembrance I had been as I
84,then was in height and proportion. I had never yet seen a being
84,resembling me or who claimed any intercourse with me. What was I? The
84,"question again recurred, to be answered only with groans."
84,
84,"“I will soon explain to what these feelings tended, but allow me now to"
84,"return to the cottagers, whose story excited in me such various"
84,"feelings of indignation, delight, and wonder, but which all terminated"
84,"in additional love and reverence for my protectors (for so I loved, in"
84,"an innocent, half-painful self-deceit, to call them).”"
84,
84,
84,
84,
84,Chapter 14
84,
84,
84,“Some time elapsed before I learned the history of my friends. It was
84,"one which could not fail to impress itself deeply on my mind, unfolding"
84,"as it did a number of circumstances, each interesting and wonderful to"
84,one so utterly inexperienced as I was.
84,
84,“The name of the old man was De Lacey. He was descended from a good
84,"family in France, where he had lived for many years in affluence,"
84,respected by his superiors and beloved by his equals. His son was bred
84,"in the service of his country, and Agatha had ranked with ladies of the"
84,highest distinction. A few months before my arrival they had lived in
84,"a large and luxurious city called Paris, surrounded by friends and"
84,"possessed of every enjoyment which virtue, refinement of intellect, or"
84,"taste, accompanied by a moderate fortune, could afford."
84,
84,“The father of Safie had been the cause of their ruin. He was a
84,"Turkish merchant and had inhabited Paris for many years, when, for some"
84,"reason which I could not learn, he became obnoxious to the government."
84,He was seized and cast into prison the very day that Safie arrived from
84,Constantinople to join him. He was tried and condemned to death. The
84,injustice of his sentence was very flagrant; all Paris was indignant;
84,and it was judged that his religion and wealth rather than the crime
84,alleged against him had been the cause of his condemnation.
84,
84,“Felix had accidentally been present at the trial; his horror and
84,indignation were uncontrollable when he heard the decision of the
84,"court. He made, at that moment, a solemn vow to deliver him and then"
84,looked around for the means. After many fruitless attempts to gain
84,"admittance to the prison, he found a strongly grated window in an"
84,"unguarded part of the building, which lighted the dungeon of the"
84,"unfortunate Muhammadan, who, loaded with chains, waited in despair the"
84,execution of the barbarous sentence. Felix visited the grate at night
84,"and made known to the prisoner his intentions in his favour. The Turk,"
84,"amazed and delighted, endeavoured to kindle the zeal of his deliverer"
84,by promises of reward and wealth. Felix rejected his offers with
84,"contempt, yet when he saw the lovely Safie, who was allowed to visit"
84,"her father and who by her gestures expressed her lively gratitude, the"
84,youth could not help owning to his own mind that the captive possessed
84,a treasure which would fully reward his toil and hazard.
84,
84,“The Turk quickly perceived the impression that his daughter had made
84,on the heart of Felix and endeavoured to secure him more entirely in
84,his interests by the promise of her hand in marriage so soon as he
84,should be conveyed to a place of safety. Felix was too delicate to
